{
  "schema_version": 1,
  "name": "verify_colored_object_grasp",
  "version": "0.1.0",
  "status": "validated",
  "formulated_by": "gpt",
  "created_at": "2026-10-26",
  "updated_at": "2026-10-26",
  "summary": "Verify a parallel-jaw test lift of a color-grounded rigid object using independent visual and gripper evidence.",
  "tool_type": "composite",
  "domains": ["verification", "rgbd", "grasping"],
  "generality": {
    "score": 5,
    "rationale": "The physical checks transfer to many table-top rigid objects, but the current implementation depends on color relocalization, a support-plane lift, and parallel-jaw aperture semantics.",
    "assumptions": [
      "The target can be relocalized by a supported dominant color after the lift.",
      "A successful grasp raises the target away from its original support.",
      "The gripper reports aperture in meters and a nonempty grasp does not fully close."
    ],
    "limitations": [
      "Not suitable for suction, pushing, in-hand occlusion, transparent targets, or deformable objects.",
      "A thin successfully grasped object may look like an empty fully closed gripper.",
      "All checks currently use one post-action snapshot instead of a synchronized temporal track."
    ],
    "tested_tasks": ["robotwin/adjust-bottle-aloha-agilex"]
  },
  "level": {
    "score": 6,
    "rationale": "It composes target relocalization, support displacement, TCP proximity, lateral displacement, visibility, and gripper state into a strict grasp verdict."
  },
  "composition": {
    "dependencies": ["locate_colored_object_3d"],
    "strategy": "Reobserve the target and combine independent geometric and gripper predicates; all predicates must currently pass."
  },
  "provenance": {
    "experiment": "adjust-bottle",
    "iteration": "iter_003",
    "failure_gap": "The learner declared grasp success after an arm motion without independent evidence that the object was held.",
    "evidence": ["iter_003 rejected false-positive grasp", "iter_007 verified grasp trace", "iter_008 successful full-task trace"]
  }
}

