{
  "schema_version": 1,
  "name": "plan_colored_top_down_grasp",
  "version": "0.1.0",
  "status": "experimental",
  "formulated_by": "gpt",
  "created_at": "2026-10-26",
  "updated_at": "2026-10-26",
  "summary": "Compose colored-object geometry, gripper contracts, TCP compensation, and chained IK into an executable top-down grasp plan.",
  "tool_type": "composite",
  "domains": ["perception", "grasping", "planning", "inverse-kinematics"],
  "generality": {
    "score": 6,
    "rationale": "The combo handles varied colored rigid tabletop objects without object-class code, but inherits HSV segmentation and top-down parallel-jaw assumptions.",
    "assumptions": [
      "The target is the largest connected component of a supported color.",
      "The target rests on a locally horizontal visible support.",
      "A top-down parallel-jaw grasp through its geometric center is suitable."
    ],
    "limitations": [
      "Does not handle arbitrary semantic categories, cluttered same-color instances, side grasps, suction, or deformables.",
      "IK waypoints are checked but the continuous path is not collision planned.",
      "A successful test lift still requires visual or contact verification."
    ],
    "tested_tasks": ["robotwin/stack-blocks-three-aloha-agilex"]
  },
  "level": {
    "score": 7,
    "rationale": "It is an orchestration layer that captures one observation and composes two reusable perception and planning subsystems into ordered action stages."
  },
  "composition": {
    "dependencies": ["estimate_colored_object_geometry_3d", "plan_top_down_parallel_grasp"],
    "strategy": "Pass a single RGB-D geometry estimate into the object-agnostic profile-aware top-down grasp planner."
  },
  "provenance": {
    "experiment": "stack-blocks-three",
    "iteration": "iter_002",
    "failure_gap": "Qwen needed a bounded high-level action that bridges successful color localization to legal reachable grasp stages without hiding reusable lower-level skills.",
    "evidence": ["iter_001 localized red, green, and blue blocks but failed before any verified grasp"]
  }
}
