{
  "schema_version": 1,
  "name": "plan_held_bottle_transfer",
  "version": "0.1.0",
  "status": "validated",
  "formulated_by": "gpt",
  "created_at": "2026-10-26",
  "updated_at": "2026-10-26",
  "summary": "Generate IK-checked lift and transfer targets for a bottle already held by a parallel-jaw gripper.",
  "tool_type": "composite",
  "domains": ["transfer", "planning", "inverse-kinematics"],
  "generality": {
    "score": 4,
    "rationale": "The live-orientation lift-and-transfer pattern can serve related rigid-object tasks, but the interface assumes a verified held bottle and encodes bottle-specific semantics.",
    "assumptions": [
      "The bottle is already securely held and the live TCP orientation should remain fixed.",
      "A vertical clearance followed by translation is collision-clear.",
      "The requested center target is meaningful for the held bottle."
    ],
    "limitations": [
      "Does not check the swept trajectory or scene collisions.",
      "Does not re-estimate the object-to-gripper transform or plan release.",
      "No recovery is provided if an IK target is invalid."
    ],
    "tested_tasks": ["robotwin/adjust-bottle-aloha-agilex"]
  },
  "level": {
    "score": 6,
    "rationale": "It combines live arm and gripper state, TCP geometry, clearance waypoint construction, profile constraints, and IK validation into a short transfer plan."
  },
  "composition": {
    "dependencies": [],
    "strategy": "Use Kinex device, frame, profile, and IK primitives directly; no other registered toolbox tool is currently invoked."
  },
  "provenance": {
    "experiment": "adjust-bottle",
    "iteration": "iter_008",
    "failure_gap": "After acquiring a verified grasp, the learner lacked a reliable collision-clear and reachable transfer plan to the task target.",
    "evidence": ["iter_008 native_success=true full-task trace"]
  }
}

